Question,Max Cosine Similarity,Correct (>=0.85),GroundTruths,RetrievedResults,TopURLs,Source
How to join in Dilution Staking?,0.8773,True,['Step 1: Visit the main site for Dilution Staking https://nft-app.trava.finance/dilution-staking  Step 2: Connect your wallet  '],"[""Introduction: As the specter of inflation pervades the crypto market, long-term token holders often find themselves struggling with the erosion of their purchasing power. In such a situation, Dilution Staking is expected to emerge as a game changer, providing a powerful shield against inflation in Trava Finance's thriving ecosystem. This is another form of staking that utilizes both Knight NFT and TRAVA, hoping to help lower the risks for investors when the price of TRAVA decreases. You can read this article for more about Dilution Staking, and go with us through this User Guide to understand how to best use this new feature. Join in Dilution Staking: Step 1: Visit the main site for Dilution Staking https://nft-app.trava.finance/dilution-staking Step 2: Connect your wallet Normal Army: : Deploy Normal Army Step 1: Select the Battlefield you want to join and click the button to create Army, for example Small Battlefield with Form Squad. You can also choose Platoon and Company. Step 2: Choose the Knights that meet the rarity and minimum power rating requirements, like here Copper, Silver and Gold, with a Power Rating of 15 for Small Battlefield. Step 3: Or you can let the system help by clicking Auto Pick, which prioritizes lower rarities. Step 4: Enter the number of TRAVA you want to stake. Step 5: Or click MAX to choose the maximum amount of TRAVA of that Battlefield size to create your army. Step 6: Select staking period, each will have a different dilution percentage. Step 7: Then you need to click Deploy. Step 8: Confirm the transaction and wait for it to complete. : Disband Claim Normal Army Step 1: From the main page of Dilution Staking, select the “All your battlefield” button in the upper right. Step 2: Select Disband for the Army you want to clear. Step 3: Then select “Disband now.” Step 4: Confirm the transaction and wait for the process to complete. Limited Knight: : Deploy Limited Knight Step 1: From the main page of Dilution Staking, select “Limited Knight” and press the “Create your staking” button on the right side of the screen. Step 2: Almost the same as with Normal Knights, except that you can choose only 1 Limited Knight, then enter the amount of TRAVA you want to stake and Deploy the Army. Step 3: You will be asked again if you want to perform this action, now click “Deploy.” Step 4: Confirm the transaction and wait for it to complete. Step 5: Click on the “Limited Knight” part again to be able to see the Limited Army you just created. : Limited Army Step 1: You can have Normal Knights join your Limited Army or someone else's, by clicking the “Join” button under the army with the suitable requirements for you. Step 2: Select Knight(s) and enter the amount of TRAVA you want to stake, or press MAX to choose the maximum amount your Knight can offer. Step 3: Click “Join Private Army.” Step 4: Confirm the transaction and wait for the process to complete. User Guide Video: To make it easier for you to understand the above, we would like to provide a short video about the tasks for Dilution Staking: PreviousveTRAVA Marketplace User Guide Last updated 1 year ago Was this helpful?"", 'NFT Brigde: Coming soon Dilution Staking: Coming soon Buyback Mechanism: Coming soon Trava NFT Auction: Coming soon NFT-collateralization: Coming soon PreviousDilution Staking Last updated 1 year ago', 'PreviousTrava Pottery User GuideNextDilution Staking User Guide Last updated 1 year ago Was this helpful?', 'This is a form of Knight NFT and TRAVA staking, aiming to reduce the impact of inflation on long-term holders in the ecosystem. : Requirements: To be able to participate in Dilution Staking, you must have the following: * TRAVA tokens to stake * Trava Knights: - Knight NFTs V2 - Limited Knight Note!! Knights V1 will not be accepted, so please Trade-up them or buy Armoury Chests V2 and assemble your Knights. Mechanism: : Knight Rarities Each Knight of a rarity has a different power rating, and maximum amount TRAVA to join a Limited Knight Battlefield. Knight Power rating Max lock on limited (TRAVA) Fee (TRAVA) Copper 1.6 10,000 500 Silver 4.4 500,000 1,320 Gold 1,000,000 3,600 Diamond 28.88 5,000,000 8,667 Crystal 280 Unlimited 84,000 : Army sizes * Each army size requires a minimum power rate and Knights of specific rarities, allowing a different maximum amount of TRAVA staked. Army Power rating Maximum stake Squad 100,000 Platoon 1,000,000 Company 350 Unlimited * For example with Medium Battlefield, a Platoon requires minimum Power Rating of 75, and Knight rarities of Copper, Silver, Gold and Diamond. The maximum amount of TRAVA can be staked is 1,000,000 TRAVA. : Lock time The longer the lock time, the higher the dilution percentage will be. Time Lock Dilution 6 Months 15.9% 1 Year 38% 1.5 Year 68.5% 2 Years 100% : Retention rate It will be calculated according to the ratio of TRAVA deposit to the amount of TRAVA circulating in the market. So when you deposit your TRAVA, all stakes will be snapshotted, ensuring your benefits are fixed at the moment of entry. For example, if a user deposits 1 million TRAVA and the total amount of TRAVA in circulation at the moment is 1 billion, then the retention rate will be 0.1%. : Actions * Users can only deposit the first time. * During the locking period, users can extend the lock time for the NFTs. Utilities: Protect long-term holders in the community against inflation, by lowering the risks when the price of TRAVA decreases. Stake rights can be exchanged like NFTs. Proof of stake can be sold on Trava Marketplace. PreviousTreasure MapNextFuture Scope Last updated 1 year ago', 'TRAVA.FINANCE: in TRAVA.FINANCE: Trava Finance in 2023: This article summarizes and reviews the most outstanding milestones in 2023 of Trava Finance, including achievements, products, events…: Dec 31, 2023 Dec 31, 2023 THE ULTIMATE GUIDE TO TRAVA FINANCE: This article once again reviews Trava Lending, Governance, Capital, Analytics Tools, and NFTs, along with Dilution Staking & Trava Station. : Nov 2, 2023 Nov 2, 2023 [AMA RECAP] ARRIVE AT TRAVA STATION: In AMA on September 6, Trava Finance provided an overview of Trava Station Testnet version, Idea Contest and answered community questions. : Sep 9, 2023 Sep 9, 2023 Dilution Staking — A Shield against Inflation for Trava Ecosystem: Dilution Staking is a new product of Trava Finance launching on July 28, 2023, provided with a detailed guide, Fortune Staker event, more…: Jul 28, 2023 Jul 28, 2023 Trade-up Mechanism — Prepare for the War of the Web3: Trade-Up V2 Mechanism will be launched soon to give Trava Knights the chance to level up their NFTs V1 and participate in Dilution Staking. : Jul 4, 2023 Jul 4, 2023 Trava to launch Knight NFT version 2: Trava Team is going to launch Knight NFTs version 2, which will be an integral part of the upcoming Dilution Staking feature. : Jun 5, 2023 Jun 5, 2023 The Introduction to Trava NFT Bridge: NFT Bridge is a new feature about to be released by Trava Finance. This post will explain why we need it, how it works and its mechanism. : May 18, 2023 May 18, 2023 Trava Ticket — Business Model: Trava ticket is an exchangeable asset that allows users to own additional perks or access to products in the Trava Ecosystem. There are…: Oct 13, 2022 Oct 13, 2022 Trava NFT Ticket Presale With NFTb: Introduction to Trava NFT Ticket: Oct 12, 2022 Oct 12, 2022 Partnership Announcement with NFTb LaunchPad: To prepare for the Trava Tickets presale event on October 26, we are pleased to announce the partnership of Trava Finance and NFTb, one of…: Oct 11, 2022 Oct 11, 2022 Trava Finance is a cross-chain lending marketplace which offers a flexible mechanism in which users can create and manage their own lending pools to start a lending business. Connect with TRAVA.FINANCE Editors:', 'Login × **Login Unsuccessful** × Looks like your connection to Trava Forum was lost, please wait while we try to reconnect.', 'Application error: a client-side exception has occurred (see the browser console for more information). :']","['https://docs.trava.finance/user-guide/dilution-staking-user-guide', 'https://docs.trava.finance/nfts/future-scope', 'https://docs.trava.finance/user-guide/vetrava-marketplace-user-guide', 'https://docs.trava.finance/nfts/dilution-staking', 'https://blog.trava.finance/tagged/nft?source=collection_home_page----75e285c42203---------------------------------', 'https://gov.trava.finance/login', 'https://trava.finance/roadmap']",['https://docs.trava.finance/user-guide/dilution-staking-user-guide']
What is Portfolio?,0.9808,True,"['To make it easier for you to track your position and assets, we have added the Portfolio feature.  This feature will display your position in the Lending Pool when you use Smart Wallet to perform actions in the pools in the Trava ecosystem. Or if you create an order to sell Armoury items, Portfolio will display those NFTs for sale, and the amount of money you have in your Smart Wallet from the sale. With more actions and features added in the future, the Portfolio page will also show more user information and details related to the Station.  ']","['To make it easier for you to track your position and assets, we have added the Portfolio feature. This feature will display your position in the Lending Pool when you use Smart Wallet to perform actions in the pools in the Trava ecosystem. Or if you create an order to sell Armoury items, Portfolio will display those NFTs for sale, and the amount of money you have in your Smart Wallet from the sale. With more actions and features added in the future, the Portfolio page will also show more user information and details related to the Station. PreviousIntroduction to Trava StationNextFreight Last updated 1 year ago', 'Login × **Login Unsuccessful** × Looks like your connection to Trava Forum was lost, please wait while we try to reconnect.', 'Application error: a client-side exception has occurred (see the browser console for more information). :', 'Register **Registration Error** × Looks like your connection to Trava Forum was lost, please wait while we try to reconnect.', ': Markets overview: Market * Governance overview: Governance * Station overview: Partnership Campaign Station * GPT overview: Trava GPT Ecosystem NetworkConnect Wallet Portfolio Portfolio is where you can keep track of all your assets and position in Trava Station. Please connect to your wallet first: Trava GPT Sign In: Your wallet is not connected yet, please connect your wallet! COPYRIGHT © 2025 Trava.Finance. All right reserved To pick up a draggable item, press the space bar. While dragging, use the arrow keys to move the item. Press space again to drop the item in its new position, or press escape to cancel.', 'PreviousBRicher User GuideNextveTRAVA Marketplace User Guide Last updated 1 year ago Was this helpful?', '1. Home 2. brenodcv 3. Following People brenodcv follows × Looks like your connection to Trava Forum was lost, please wait while we try to reconnect.']","['https://docs.trava.finance/trava-station/portfolio', 'https://gov.trava.finance/login', 'https://trava.finance/roadmap', 'https://gov.trava.finance/register', 'https://app.trava.finance/station/portfolio', 'https://docs.trava.finance/user-guide/trava-pottery-user-guide', 'https://gov.trava.finance/user/brenodcv/following']",['https://docs.trava.finance/trava-station/portfolio']
What is Tramlines for?,0.9476,True,"['Therefore, we would like to introduce Tramlines, a new feature added into Trava Station on October 11, 2023 👉 https://app.trava.finance/station/tramlines. It provides users with common sets of pre-arranged actions to import, which are called Routes. In each route, the name will be displayed, followed by the description, requirements and so on. Tramlines also estimates the amount of gas needed using Trava Station, then compares it to the amount when performing each action separately like normal. After choosing, now you can edit the amount for each factor in Freight according to your needs.  ']","[': Markets overview: Market * Governance overview: Governance * Station overview: Partnership Campaign Station * GPT overview: Trava GPT Ecosystem NetworkConnect Wallet Tramlines Tramlines provide a list of pre-made routes of common actions for you to import. Your Tramlines System Tramlines Freight Recommend For You Finding the most optimized Routes with the help of BRicher for maximum profits. Please connect your wallet. Your Created Tramlines Use Trava Station to build Tramlines according to your own wishes, comfortably managing the DeFi space from Trava AI-driven Lending Station. Direction DESC Direction Sort by Saved gas Sort by Filters No Data Trava GPT Sign In: Your wallet is not connected yet, please connect your wallet! COPYRIGHT © 2025 Trava.Finance. All right reserved To pick up a draggable item, press the space bar. While dragging, use the arrow keys to move the item. Press space again to drop the item in its new position, or press escape to cancel.', 'Before, if you want to make similar transactions, you will have to repeat it each time. Now, Trava Station does help reduce the time-consuming steps of changing dApps, but you still need to drag and drop from the start again. Or you would have to spend time figuring out which actions are required and in what order. All these operations can be so boring and laborious. Therefore, we would like to introduce Tramlines, a new feature added into Trava Station on October 11, 2023 👉 https://app.trava.finance/station/tramlines. It provides users with common sets of pre-arranged actions to import, which are called Routes. In each route, the name will be displayed, followed by the description, requirements and so on. Tramlines also estimates the amount of gas needed using Trava Station, then compares it to the amount when performing each action separately like normal. After choosing, now you can edit the amount for each factor in Freight according to your needs. If you have any wanted actions in your mind, feel free to suggest them to us — even though the Bug Hunt has ended, Suggestions topic in Trava Forum will continue to be open. Tramlines are constantly being improved and we will add more Routes to make your experience more convenient. For now, here are the ones already been released:', ': Markets overview: Market * Governance overview: Governance * Station overview: Partnership Campaign Station * GPT overview: Trava GPT Ecosystem NetworkConnect Wallet Tramlines Tramlines provide a list of pre-made routes of common actions for you to import. Your Tramlines System Tramlines Freight Direction DESC Direction Sort by Saved gas Sort by Filters Loading... Trava GPT Sign In: Your wallet is not connected yet, please connect your wallet! COPYRIGHT © 2025 Trava.Finance. All right reserved To pick up a draggable item, press the space bar. While dragging, use the arrow keys to move the item. Press space again to drop the item in its new position, or press escape to cancel.', 'Ask for Suggestions</strong></p> <p dir=""auto""><img src=""https://gov.trava.finance/assets/plugins/nodebb-plugin-emoji/emoji/android/1f4a1.png?v=r9reoov69kc"" class=""not-responsive emoji emoji-android emoji--bulb"" title="":bulb:"" alt=""💡"" /> Reply under this topic your <strong>idea(s) answering</strong> the following question: <strong>What actions in Trava Finance ecosystem do you use the most / think should be included in Tramlines?</strong><br /> <img src=""https://gov.trava.finance/assets/plugins/nodebb-plugin-emoji/emoji/android/1f4a1.png?v=r9reoov69kc"" class=""not-responsive emoji emoji-android emoji--bulb"" title="":bulb:"" alt=""💡"" /> After collecting the answers, we will <strong>create polls</strong> for the community to choose the most reasonable ideas to be executed.<br /> <img src=""https://gov.trava.finance/assets/plugins/nodebb-plugin-emoji/emoji/android/1f4a1.png?v=r9reoov69kc"" class=""not-responsive emoji emoji-android emoji--bulb"" title="":bulb:"" alt=""💡"" /> <strong>5 people</strong> will be rewarded, after providing <strong>proofs of fulfilling</strong> our requirements.</p> <p dir=""auto""><em><img src=""https://gov.trava.finance/assets/plugins/nodebb-plugin-emoji/emoji/android/23f3.png?v=r9reoov69kc"" class=""not-responsive emoji emoji-android emoji--hourglass_flowing_sand"" title="":hourglass_flowing_sand:"" alt=""⏳"" />Timer:</em> <strong>[1 month]</strong> 25th August - September || 2PM UTC</p> ]]> ... </description> <link>https://gov.trava.finance/topic/61/idea-contest-for-trava-station</link> <generator>RSS for Node</generator> <lastBuildDate>Fri, 07 Feb 2025 02:51:19 GMT</lastBuildDate> <atom:link href=""https://gov.trava.finance/topic/61.rss"" rel=""self"" type=""application/rss+xml""/> <pubDate>Fri, 25 Aug 2023 14:00:00 GMT</pubDate> <ttl>60</ttl> <item> <title> <! [CDATA[ Reply to Idea Contest for Trava Station on Mon, 25 Sep 2023 11:01:03 GMT ]]> ... </title> <description> <! [CDATA[ <p dir=""auto"">I find trava station to be a really convenient dapp. But I think there should be an additional fee for each transaction so we can measure how much this trava statin can save.</p> ]]> ... </description> <link>https://gov.trava.finance/post/256</link> <guid isPermaLink=""true"">https://gov.trava.finance/post/256</guid> <dc:creator> <! [CDATA[ Henry ]]> ... </dc:creator> <pubDate>Mon, 25 Sep 2023 11:01:03 GMT</pubDate> ... </item> <item> <title> <! [CDATA[ Reply to Idea Contest for Trava Station on Mon, 11 Sep 2023 16:42:03 GMT ]]> ... </title> <description> <! [CDATA[ <p dir=""auto"">We know that TRAVA STATION aims to save time and fees on transactions.</p> <p dir=""auto"">Users are increasingly looking for opportunities to earn in the crypto market, so we could develop at the station a way to show the possibility of arbitrage in cryptocurrencies in different pairs and show the user based on their wallet what the earning possibilities are, all of this connected to varied DAPPS to obtain the best advantages in exchanging from one asset to another in different DEFI</p> <p dir=""auto"">And everyone who wants to use this functionality must have the TRAVA token in their wallet in a certain amount, this will generate more usability for the token in addition to the adoption of new users to use this fantastic function on the TRAVA platform.</p> ]]> ... </description> <link>https://gov.trava.finance/post/251</link> <guid isPermaLink=""true"">https://gov.trava.finance/post/251</guid> <dc:creator> <! [CDATA[ brenodcv ]]> ... </dc:creator> <pubDate>Mon, 11 Sep 2023 16:42:03 GMT</pubDate> ... </item> <item> <title> <! [CDATA[ Reply to Idea Contest for Trava Station on Wed, 06 Sep 2023 15:03:46 GMT ]]> ... </title> <description> <!', ': Markets overview: Market * Governance overview: Governance * Station overview: Partnership Campaign Station * GPT overview: Trava GPT Ecosystem NetworkConnect Wallet Freight Trava Freight allows users to execute the sequence of actions according to their own demands. Your Tramlines System Tramlines Freight Search Swap Add liquidity v2 Remove liquidity v2 Stake LP token v2 Unstake LP token V2 Harvest Please connect to your wallet first! Final state after recipe A Smart Wallet is required to execute a recipe. It enables executing complex transactions and adds a layer of security protecting you from contract exploits. Trava GPT Sign In: Your wallet is not connected yet, please connect your wallet! COPYRIGHT © 2025 Trava.Finance. All right reserved To pick up a draggable item, press the space bar. While dragging, use the arrow keys to move the item. Press space again to drop the item in its new position, or press escape to cancel.', 'Application error: a client-side exception has occurred (see the browser console for more information). :', ': Markets overview: Market * Governance overview: Governance * Station overview: Partnership Campaign Station * GPT overview: Trava GPT Ecosystem NetworkConnect Wallet Freight Trava Freight allows users to execute the sequence of actions according to their own demands. Your Tramlines System Tramlines Freight Search TRAVA/TOD Listing Liquidity Call Join Withdraw Claim Please connect to your wallet first! Final state after recipe A Smart Wallet is required to execute a recipe. It enables executing complex transactions and adds a layer of security protecting you from contract exploits. Trava GPT Sign In: Your wallet is not connected yet, please connect your wallet! COPYRIGHT © 2025 Trava.Finance. All right reserved To pick up a draggable item, press the space bar. While dragging, use the arrow keys to move the item. Press space again to drop the item in its new position, or press escape to cancel.']","['https://app.trava.finance/station/tramlines/owner', 'https://docs.trava.finance/trava-station/tramlines', 'https://app.trava.finance/station/tramlines', 'https://gov.trava.finance/topic/61.rss', 'https://app.trava.finance/station?group=pancake', 'https://trava.finance/roadmap', 'https://app.trava.finance']",['https://docs.trava.finance/trava-station/tramlines']
