Question,Max Cosine Similarity,Correct (>=0.85),GroundTruths,RetrievedResults,TopURLs,Source
What is Trava Finance?,0.9633,True,"['TRAVA FINANCE is the world’s first decentralized marketplace for cross-chain lending. Different from existing approaches, we offer a flexible mechanism in which users can create and manage their own lending pools to start a lending business. ', 'Trava Finance is a DeFi protocol that aims to become an AI-driven Lending Station, that provides unique Lending services. ']","['TRAVA.FINANCE (or TRAVA) is the world’s first decentralized marketplace for cross-chain lending. A detailed and technical description can be found in the whitepaper. If you need development support, join the Technical on Telegram. Last updated 3 years ago Was this helpful?', 'TRAVA.FINANCE: Connect with TRAVA.FINANCE: Trava Finance is a cross-chain lending marketplace which offers a flexible mechanism in which users can create and manage their own lending pools to start a lending business. Connect with TRAVA.FINANCE Editors:', 'Followers: 245 Followers: Trava Finance is a cross-chain lending marketplace which offers a flexible mechanism in which users can create and manage their own lending pools to start a lending business. Connect with TRAVA.FINANCE Editors:', 'Followers: 245 Followers: Trava Finance is a cross-chain lending marketplace which offers a flexible mechanism in which users can create and manage their own lending pools to start a lending business. Connect with TRAVA.FINANCE Editors:', 'Followers: 245 Followers: Trava Finance is a cross-chain lending marketplace which offers a flexible mechanism in which users can create and manage their own lending pools to start a lending business. Connect with TRAVA.FINANCE Editors:', 'Followers: 245 Followers: Trava Finance is a cross-chain lending marketplace which offers a flexible mechanism in which users can create and manage their own lending pools to start a lending business. Connect with TRAVA.FINANCE Editors:', 'Register **Registration Error** × Looks like your connection to Trava Forum was lost, please wait while we try to reconnect.']","['https://docs.trava.finance/portal/developers', 'https://blog.trava.finance/about?source=collection_home_page----75e285c42203---------------------------------', 'https://blog.trava.finance/followers?source=post_page---post_publication_info--06d59019f830--------------------------------', 'https://blog.trava.finance/followers?source=post_page---post_publication_info--b8b88004ff69--------------------------------', 'https://blog.trava.finance/followers?source=collection_home_page----75e285c42203---------------------------------', 'https://blog.trava.finance/followers?source=post_page---post_publication_info--ea62b9f9b65--------------------------------', 'https://gov.trava.finance/register']","['https://docs.trava.finance/portal', 'https://blog.trava.finance/trava-finance-in-2023-206167384f14']"
What does Trava offer?,0.9106,True,['TRAVA offers a flexible mechanism in which users can create and manage their own lending pools to start a lending business. TRAVA also offers the credit score function based on financial data on-chain analysis as a useful tool that reduces risk and increases profits for all users. '],"['Register **Registration Error** × Looks like your connection to Trava Forum was lost, please wait while we try to reconnect.', 'Login × **Login Unsuccessful** × Looks like your connection to Trava Forum was lost, please wait while we try to reconnect.', 'TRAVA.FINANCE (or TRAVA) is the world’s first decentralized marketplace for cross-chain lending. A detailed and technical description can be found in the whitepaper. If you need development support, join the Technical on Telegram. Last updated 3 years ago Was this helpful?', '1. Home 2. Users * 4 minutes ago * about an hour ago * about 2 hours ago * about 3 hours ago * about 4 hours ago * about 6 hours ago * about 7 hours ago * about 7 hours ago * about 8 hours ago * about 9 hours ago * about 10 hours ago * about 11 hours ago * about 11 hours ago * about 11 hours ago * about 12 hours ago * about 13 hours ago * about 13 hours ago * about 14 hours ago * about 14 hours ago * about 14 hours ago * about 15 hours ago * about 15 hours ago * about 15 hours ago * about 16 hours ago * about 16 hours ago * about 16 hours ago * about 17 hours ago * about 17 hours ago * about 18 hours ago * about 18 hours ago * about 20 hours ago * about 20 hours ago * about 20 hours ago * about 20 hours ago * about 20 hours ago * about 20 hours ago * about 20 hours ago * about 21 hours ago * about 21 hours ago * about 21 hours ago * about 23 hours ago * a day ago * a day ago * a day ago * a day ago * a day ago * a day ago * a day ago * a day ago * a day ago × Looks like your connection to Trava Forum was lost, please wait while we try to reconnect.', 'TRAVA.FINANCE: Connect with TRAVA.FINANCE: Trava Finance is a cross-chain lending marketplace which offers a flexible mechanism in which users can create and manage their own lending pools to start a lending business. Connect with TRAVA.FINANCE Editors:', ""1. Home 2. Henry 3. Topics Topics created by Henry This user hasn't posted any topics yet. × Looks like your connection to Trava Forum was lost, please wait while we try to reconnect."", 'Followers: 245 Followers: Trava Finance is a cross-chain lending marketplace which offers a flexible mechanism in which users can create and manage their own lending pools to start a lending business. Connect with TRAVA.FINANCE Editors:']","['https://gov.trava.finance/register', 'https://gov.trava.finance/login', 'https://docs.trava.finance/portal/developers', 'https://gov.trava.finance/users', 'https://blog.trava.finance/about?source=collection_home_page----75e285c42203---------------------------------', 'https://gov.trava.finance/user/henry/topics', 'https://blog.trava.finance/followers?source=post_page---post_publication_info--ea62b9f9b65--------------------------------']",['https://docs.trava.finance/faq']
How to interconnect with Trava protocol?,0.8747,True,"['In order to interconnect with Trava protocol, you need to deposit your asset into lending pools. After depositing, you will earn passive income, this income is based on the market borrowing demand. Additionally, you can also borrow by using your deposited assets as collateral.']","['Register **Registration Error** × Looks like your connection to Trava Forum was lost, please wait while we try to reconnect.', 'Login × **Login Unsuccessful** × Looks like your connection to Trava Forum was lost, please wait while we try to reconnect.', '1. Home 2. Users * 4 minutes ago * about an hour ago * about 2 hours ago * about 3 hours ago * about 4 hours ago * about 6 hours ago * about 7 hours ago * about 7 hours ago * about 8 hours ago * about 9 hours ago * about 10 hours ago * about 11 hours ago * about 11 hours ago * about 11 hours ago * about 12 hours ago * about 13 hours ago * about 13 hours ago * about 14 hours ago * about 14 hours ago * about 14 hours ago * about 15 hours ago * about 15 hours ago * about 15 hours ago * about 16 hours ago * about 16 hours ago * about 16 hours ago * about 17 hours ago * about 17 hours ago * about 18 hours ago * about 18 hours ago * about 20 hours ago * about 20 hours ago * about 20 hours ago * about 20 hours ago * about 20 hours ago * about 20 hours ago * about 20 hours ago * about 21 hours ago * about 21 hours ago * about 21 hours ago * about 23 hours ago * a day ago * a day ago * a day ago * a day ago * a day ago * a day ago * a day ago * a day ago * a day ago × Looks like your connection to Trava Forum was lost, please wait while we try to reconnect.', ""1. Home 2. Henry 3. Topics Topics created by Henry This user hasn't posted any topics yet. × Looks like your connection to Trava Forum was lost, please wait while we try to reconnect."", 'Replying to ""Idea Contest for Trava Station"" Discard Submit Compose Show Preview Hide Preview × Looks like your connection to Trava Forum was lost, please wait while we try to reconnect.', 'TRAVA.FINANCE: Connect with TRAVA.FINANCE: Trava Finance is a cross-chain lending marketplace which offers a flexible mechanism in which users can create and manage their own lending pools to start a lending business. Connect with TRAVA.FINANCE Editors:', ""1. Home 2. Henry 3. Groups Henry's Groups There are no groups to see × Looks like your connection to Trava Forum was lost, please wait while we try to reconnect.""]","['https://gov.trava.finance/register', 'https://gov.trava.finance/login', 'https://gov.trava.finance/users', 'https://gov.trava.finance/user/henry/topics', 'https://gov.trava.finance/compose?tid=61&title=Idea Contest for Trava Station', 'https://blog.trava.finance/about?source=collection_home_page----75e285c42203---------------------------------', 'https://gov.trava.finance/user/henry/groups']",['https://docs.trava.finance/faq']
Do I need to pay fees to interconnect with Trava protocol?,0.7073,False,"['Interacting with the protocol requires transactions and so transaction fees for BSC Blockchain usage, which depend on the network status and transaction complexity. ']","['Register **Registration Error** × Looks like your connection to Trava Forum was lost, please wait while we try to reconnect.', 'Login × **Login Unsuccessful** × Looks like your connection to Trava Forum was lost, please wait while we try to reconnect.', '1. Home 2. Users * 4 minutes ago * about an hour ago * about 2 hours ago * about 3 hours ago * about 4 hours ago * about 6 hours ago * about 7 hours ago * about 7 hours ago * about 8 hours ago * about 9 hours ago * about 10 hours ago * about 11 hours ago * about 11 hours ago * about 11 hours ago * about 12 hours ago * about 13 hours ago * about 13 hours ago * about 14 hours ago * about 14 hours ago * about 14 hours ago * about 15 hours ago * about 15 hours ago * about 15 hours ago * about 16 hours ago * about 16 hours ago * about 16 hours ago * about 17 hours ago * about 17 hours ago * about 18 hours ago * about 18 hours ago * about 20 hours ago * about 20 hours ago * about 20 hours ago * about 20 hours ago * about 20 hours ago * about 20 hours ago * about 20 hours ago * about 21 hours ago * about 21 hours ago * about 21 hours ago * about 23 hours ago * a day ago * a day ago * a day ago * a day ago * a day ago * a day ago * a day ago * a day ago * a day ago × Looks like your connection to Trava Forum was lost, please wait while we try to reconnect.', 'Replying to ""Idea Contest for Trava Station"" Discard Submit Compose Show Preview Hide Preview × Looks like your connection to Trava Forum was lost, please wait while we try to reconnect.', ""1. Home 2. Henry 3. Topics Topics created by Henry This user hasn't posted any topics yet. × Looks like your connection to Trava Forum was lost, please wait while we try to reconnect."", 'TRAVA.FINANCE: Connect with TRAVA.FINANCE: Trava Finance is a cross-chain lending marketplace which offers a flexible mechanism in which users can create and manage their own lending pools to start a lending business. Connect with TRAVA.FINANCE Editors:', 'Replying to ""Call for suggestions to improve Trava Station to best suits your demands."" Discard Submit Compose Show Preview Hide Preview × Looks like your connection to Trava Forum was lost, please wait while we try to reconnect.']","['https://gov.trava.finance/register', 'https://gov.trava.finance/login', 'https://gov.trava.finance/users', 'https://gov.trava.finance/compose?tid=61&title=Idea Contest for Trava Station', 'https://gov.trava.finance/user/henry/topics', 'https://blog.trava.finance/about?source=collection_home_page----75e285c42203---------------------------------', 'https://gov.trava.finance/compose?tid=57&title=Call for suggestions to improve Trava Station to best suits your demands.']",['https://docs.trava.finance/faq']
Does Trava have a Mobile App?,0.8039,False,"['Be careful, we don’t provide any downloaded applications for mobile. Trava also never carries advertisements on any social media or search engine. Please stay away from those adverts if you see, it is a scam. In addition, Trava Protocol would not ask for your seed passphrase ever. ']","['Register **Registration Error** × Looks like your connection to Trava Forum was lost, please wait while we try to reconnect.', 'Login × **Login Unsuccessful** × Looks like your connection to Trava Forum was lost, please wait while we try to reconnect.', 'TRAVA.FINANCE (or TRAVA) is the world’s first decentralized marketplace for cross-chain lending. A detailed and technical description can be found in the whitepaper. If you need development support, join the Technical on Telegram. Last updated 3 years ago Was this helpful?', '1. Home 2. Users * 4 minutes ago * about an hour ago * about 2 hours ago * about 3 hours ago * about 4 hours ago * about 6 hours ago * about 7 hours ago * about 7 hours ago * about 8 hours ago * about 9 hours ago * about 10 hours ago * about 11 hours ago * about 11 hours ago * about 11 hours ago * about 12 hours ago * about 13 hours ago * about 13 hours ago * about 14 hours ago * about 14 hours ago * about 14 hours ago * about 15 hours ago * about 15 hours ago * about 15 hours ago * about 16 hours ago * about 16 hours ago * about 16 hours ago * about 17 hours ago * about 17 hours ago * about 18 hours ago * about 18 hours ago * about 20 hours ago * about 20 hours ago * about 20 hours ago * about 20 hours ago * about 20 hours ago * about 20 hours ago * about 20 hours ago * about 21 hours ago * about 21 hours ago * about 21 hours ago * about 23 hours ago * a day ago * a day ago * a day ago * a day ago * a day ago * a day ago * a day ago * a day ago * a day ago × Looks like your connection to Trava Forum was lost, please wait while we try to reconnect.', ""1. Home 2. Henry 3. Topics Topics created by Henry This user hasn't posted any topics yet. × Looks like your connection to Trava Forum was lost, please wait while we try to reconnect."", 'Replying to ""Idea Contest for Trava Station"" Discard Submit Compose Show Preview Hide Preview × Looks like your connection to Trava Forum was lost, please wait while we try to reconnect.', 'TRAVA.FINANCE: Connect with TRAVA.FINANCE: Trava Finance is a cross-chain lending marketplace which offers a flexible mechanism in which users can create and manage their own lending pools to start a lending business. Connect with TRAVA.FINANCE Editors:']","['https://gov.trava.finance/register', 'https://gov.trava.finance/login', 'https://docs.trava.finance/portal/developers', 'https://gov.trava.finance/users', 'https://gov.trava.finance/user/henry/topics', 'https://gov.trava.finance/compose?tid=61&title=Idea Contest for Trava Station', 'https://blog.trava.finance/about?source=collection_home_page----75e285c42203---------------------------------']",['https://docs.trava.finance/faq']
How to deposit on Trava?,0.9536,True,"['Access to https://app.trava.finance Connect your wallet. Make sure that you are on the BSC network (If not, you will need to reconnect) Select the asset you that you want to deposit from the available options Select the deposit button on the left and input the amount of the asset you want to stake Approve the transaction in your wallet. ', 'Step 1. Open https://app.trava.finance/pools Step 2. Connect your wallet and select the network that you want. Step 3. Click an asset that you want to deposit  Step 4. Click “Deposit”  Step 5. After that, your wallet notification will appear as below: Enter the number of assets that you want to deposit in the box “Amount” Make sure you check all the current and updated information. Then click “Confirm”.  Step 6. Waiting for the deposit processing: confirmation => executing transaction => Transaction succeeded.    Notes: Click “See transaction detail” to review your transaction.']","['Register **Registration Error** × Looks like your connection to Trava Forum was lost, please wait while we try to reconnect.', 'Login × **Login Unsuccessful** × Looks like your connection to Trava Forum was lost, please wait while we try to reconnect.', '1. Home 2. Users * 4 minutes ago * about an hour ago * about 2 hours ago * about 3 hours ago * about 4 hours ago * about 6 hours ago * about 7 hours ago * about 7 hours ago * about 8 hours ago * about 9 hours ago * about 10 hours ago * about 11 hours ago * about 11 hours ago * about 11 hours ago * about 12 hours ago * about 13 hours ago * about 13 hours ago * about 14 hours ago * about 14 hours ago * about 14 hours ago * about 15 hours ago * about 15 hours ago * about 15 hours ago * about 16 hours ago * about 16 hours ago * about 16 hours ago * about 17 hours ago * about 17 hours ago * about 18 hours ago * about 18 hours ago * about 20 hours ago * about 20 hours ago * about 20 hours ago * about 20 hours ago * about 20 hours ago * about 20 hours ago * about 20 hours ago * about 21 hours ago * about 21 hours ago * about 21 hours ago * about 23 hours ago * a day ago * a day ago * a day ago * a day ago * a day ago * a day ago * a day ago * a day ago * a day ago × Looks like your connection to Trava Forum was lost, please wait while we try to reconnect.', ""1. Home 2. Henry 3. Topics Topics created by Henry This user hasn't posted any topics yet. × Looks like your connection to Trava Forum was lost, please wait while we try to reconnect."", 'How to deposit? : Access to https://app.trava.finance Connect your wallet. Make sure that you are on the BSC network (If not, you will need to reconnect) Select the asset you that you want to deposit from the available options Select the deposit button on the left and input the amount of the asset you want to stake Approve the transaction in your wallet. My earning: Your earning depends on your depositing amount. The greater the amount, the greater the earning you get. The APY ratios for each type of asset are shown on the dashboard of the staking site, you can follow it anytime. Is there a limited amount to deposit/stake? : There is no limitation for minimum or maximum amount, you can deposit any amount you want. But we mention that you should consider when depositing a very small amount. Because for a really small amount, the transaction costs of the depositing process can be higher than your expected earnings. How to withdraw? : To withdraw you just need to Click the “Withdraw” button on the vault in the dashboard. Select the amount to withdraw and submit the transaction. PreviousIntroduction to TravaNextBorrowing Last updated 2 years ago Was this helpful?', 'Connect your wallet and select a network: : Connect wallet: Step 1. Open https://app.trava.finance/pools Step 2. Click "" Connect wallet "" on the top right corner as below. Step 3. Choose your wallet : Select the network: Step 1. Click the network name on the top-right corner Step 2. Select the network that you want: 04 main actions in the Trava Lending pool: : Deposit an asset in the lending pool. Step 1. Open https://app.trava.finance/pools Step 2. Connect your wallet and select the network that you want. Step 3. Click an asset that you want to deposit Step 4. Click “Deposit” Step 5. After that, your wallet notification will appear as below: * Enter the number of assets that you want to deposit in the box “Amount” * Make sure you check all the current and updated information. * Then click “Confirm”. Step 6. Waiting for the deposit processing: confirmation => executing transaction => Transaction succeeded. Notes: Click “See transaction detail” to review your transaction. : Withdraw an asset Step 1. Open https://app.trava.finance/pools Step 2. Connect your wallet and select the network that you want. Step 3. Click an asset that you want to withdraw Step 4. Click “Withdraw” Step 5. After that, your wallet notification will appear as below: * Enter the number of assets that you want to withdraw in the box “Amount” * Make sure you check all the current and updated information. * Then click “Withdraw” Step 6. Waiting for the deposit processing: Confirmation => executing transaction => Transaction succeeded. Notes: Click “See transaction detail” to review your transaction. : Borrow an asset in a pool Step 1. Open https://app.trava.finance/pools Step 2. Connect your wallet and select the network that you want. Step 3. Click an asset that you want to borrow Step 4. Click “Borrow” Step 5. After that, your wallet notification will appear as below: * Enter the number of assets that you want to borrow in the box “Amount” * Make sure you check all the current and updated information. * Then click “Borrow” Step 6. Waiting for the deposit processing: Confirmation => executing transaction => Transaction succeeded. Notes: Click “See transaction detail” to review your transaction. : Repay your loan Step 1. Open https://app.trava.finance/pools Step 2. Connect your wallet and select the network that you want. Step 3. Click an asset that you want to repay Step 4. Click “Repay” Step 5. After that, your wallet notification will appear as below: * Enter the number of assets that you want to repay in the box “Amount” * Make sure you check all the current and updated information. * Then click “Repay” Step 6. Waiting for the deposit processing: Confirmation => executing transaction => Transaction succeeded. Notes: Click “See transaction detail” to review your transaction. List of tokens supported by TRAVA: In the near future, we are going to support more tokens to optimize users experience and help them master their lending business! PreviousTrava Pool Creation User GuideNextTrava Forum User Guide Last updated 2 years ago Was this helpful?', 'Register: Step 1: * Go to: https://gov.trava.finance/ * Click “Register” Step 2: * Enter “Username” * Enter “Password” * Confirm ""Password"" * Click “Register Now” Step 3: * Fill in your email address * Click “Submit” Step 4: Confirm your registration in the mail box Log in: Step 1: * Go to: https://gov.trava.finance/ * Click “Login” Step 2: * Put in email address * Enter password * Click “Login” Open topic: Step 1: * Choose the category you would like to discuss Step 2: Create your discussion Step 3: See your topic posted on the Forum Step 4: Tracking your discussions * Click the bell button * Switch to “Watching” to receive all the related notifications. Engage in other topics: Upvote and Downvote in Trava Forum: Click on the down-ward or upward arrow to show support or disagreement. Leave a comment on other topic on Trava Forum * Choose the topic you would like to comment on * Click “Reply” Put in your comment Click “Submit” Quote a topic * Choose the topic you would like to comment on * Click “Quote” Click “Submit” PreviousLending Pool User GuideNextTrava DAO User Guide Last updated 2 years ago Was this helpful?']","['https://gov.trava.finance/register', 'https://gov.trava.finance/login', 'https://gov.trava.finance/users', 'https://gov.trava.finance/user/henry/topics', 'https://docs.trava.finance/faq/staking-depositing-and-earning', 'https://docs.trava.finance/user-guide/lending-pool-user-guide', 'https://docs.trava.finance/user-guide/trava-forum-user-guide']","['https://docs.trava.finance/faq/staking-depositing-and-earning', 'https://docs.trava.finance/user-guide/lending-pool-user-guide']"
