Question,Max Cosine Similarity,Correct (>=0.85),GroundTruths,RetrievedResults,TopURLs,Source
How to merge veTRAVA tokens?,0.9063,True,"['1. Select 2 veTRAVA tokens to merge together. veTRAVA with Released status can’t be merged. 2. Claim all claimable rewards of 2 veTRAVA tokens. 3. Click Merge.  4. Recheck your veTRAVA info and click Merge to preview merge result.  5. Click Confirm. 6. Your wallet notification will appear, you check again the total amount and gas fee. If they are right, click Confirm. ']","['Lock your tokens for veTRAVA: : Lock Calculator Select the token you want to lock, input lock amount, and select unlock time to see how many voting power you will have. : Create new veTRAVA lock 1. Click Create Lock , a modal will popup. 2. Select the token you want to lock. 3. Input lock amount. 4. Select unlock time (1 week -> 4 years). 5. Click Create Lock . 6. Your wallet notification will appear, you check again the total amount and gas fee. If they are right, click Confirm. : Merge veTRAVA 1. Select 2 veTRAVA tokens to merge together. veTRAVA with Released status can’t be merged. 2. Claim all claimable rewards of 2 veTRAVA tokens. 3. Click Merge. 4. Recheck your veTRAVA info and click Merge to preview merge result. 5. Click Confirm. 6. Your wallet notification will appear, you check again the total amount and gas fee. If they are right, click Confirm. : Claim rewards 1. Click Claim. 2. Your wallet notification will appear, you check again the total amount and gas fee. If they are right, click Confirm. : Withdraw veTRAVA 1. Claim all your claimable rewards. 2. Your wallet notification will appear, you check again the total amount and gas fee. If they are right, click Confirm. Increase your voting power: : Increase locked balance 1. Input the increased amount and see how much voting power you will gain. 2. Click Lock Balance. 3. Your wallet notification will appear, you check again the total amount and gas fee. If they are right, click Confirm. : Increase unlock time 1. Select the unlock time option to increase and see how much voting power you will gain. 2. Click Lock Time. 3. Your wallet notification will appear, you check again the total amount and gas fee. If they are right, click Confirm. How to vote? : : Proposal Status After being created on-chain, a proposal can have 8 types of statuses: * Pending: signals the waiting period before voting, the community can prepare their voting power during this period. * Active: signals the voting period, anyone can vote For or Against once for each proposal. * Cancel: signals a proposal has been canceled by the SAB or the proposer themselves for some reason. * Defeated: signals a defeated proposal. * Succeeded: signals a succeeded proposal, which can only occur when the quorum is reached and the For votes surpass the Against votes. * Queued: signals the delay process for a proposal to be executed after a successful voting period. * Executed: signals all proposal’s actions have been performed correctly. * Expired: signals a proposal could not be executed for some reason after the delay process. : Cast your vote 1. Click the proposal’s title or double-click the proposal component in the proposals list. 2. Read thoroughly the proposal’s details and decide to vote For or Against . 3. Click For/Against button depending on your decision. 4. Click Confirm. 5. Your wallet notification will appear, you check again the total amount and gas fee. If they are right, click Confirm . PreviousTrava Forum User GuideNextTrava Fortune Mining User Guide Last updated 2 years ago Was this helpful?', 'BSC MainnetConnect wallet: Dashboard Total token voted-locked Total voting power % Voted-locked % Total locked Avg. lock-in period % APR % warm-up APR Governance Voting Power 1W 1M 1Y ALL Created with Highcharts 10.1.0 Voting Power Histogram Created with Highcharts 10.1.0Voting PowerNumber of wallets Lock-in Period Histogram Created with Highcharts 10.1.0Avg. lock-in periodNumber of veTravaNFTs veTrava Holders No.| Wallet Address| Voting Power| Avg. lock-in period ---|---|---|--- Markets Staking Governance Station Trava GPT Markets overview Pools Create Pool Staking overview Governance overview Dashboard Locker Vote Forum Docs Reputation Ranking Station overview Portfolio Freight Junction Partnership Campaign Analytics Recommendation Trava GPT overview Ecosystem NFTBridge Trava GPT Sign In: Your wallet is not connected yet, please connect your wallet!', 'BSC MainnetConnect wallet: Dashboard Total token voted-locked Total voting power % Voted-locked % Total locked Avg. lock-in period % APR % warm-up APR Governance Voting Power 1W 1M 1Y ALL Created with Highcharts 10.1.0 Voting Power Histogram Created with Highcharts 10.1.0Voting PowerNumber of wallets Lock-in Period Histogram Created with Highcharts 10.1.0Avg. lock-in periodNumber of veTravaNFTs veTrava Holders No.| Wallet Address| Voting Power| Avg. lock-in period ---|---|---|--- Markets Staking Governance Station Trava GPT Markets overview Pools Create Pool Staking overview Governance overview Dashboard Locker Vote Forum Docs Reputation Ranking Station overview Portfolio Freight Junction Partnership Campaign Analytics Recommendation Trava GPT overview Ecosystem NFTBridge Trava GPT Sign In: Your wallet is not connected yet, please connect your wallet!', 'PreviousBRicher User GuideNextveTRAVA Marketplace User Guide Last updated 1 year ago Was this helpful?', 'As mentioned, with each quiz package, we will set a particular reward amount to distribute equally to the winners of each package. For example, if the total rewards of the Trava Pool Creation Package are 1000$ and there are 10 winners, each can get up to 100$. However, this amount will not be fully sent to the winner but also be contributed to the other funds used for philanthropy activities, or rewarding the Governance, Top user, etc. In particular, the reward (as in the example is 100$) will be spent as below: * 40%: For winners directly through their wallets (claimable within one week after the quiz end)**. ** * 40%: For winners through the vesting pool. * 5%: For the top 5 users of all quiz packages. * 5%: For the Governance (veTRAVA holders). * 10%: For referral rewards - If there is no referral, this amount will be used for philanthropy. PreviousHow to join Trava Pottery?NextVesting pool mechanism Last updated 1 year ago', 'Login × **Login Unsuccessful** × Looks like your connection to Trava Forum was lost, please wait while we try to reconnect.', 'Register **Registration Error** × Looks like your connection to Trava Forum was lost, please wait while we try to reconnect.']","['https://docs.trava.finance/user-guide/trava-dao-user-guide', 'https://app.trava.finance/governance', 'https://app.trava.finance/governance/dashboard', 'https://docs.trava.finance/user-guide/trava-pottery-user-guide', 'https://docs.trava.finance/pottery-mechanism/rewards-mechanism', 'https://gov.trava.finance/login', 'https://gov.trava.finance/register']",['https://docs.trava.finance/user-guide/trava-dao-user-guide']
How to claim rewards from veTRAVA?,0.8054,False,"['1. Click Claim. 2. Your wallet notification will appear, you check again the total amount and gas fee. If they are right, click Confirm. ']","['Lock your tokens for veTRAVA: : Lock Calculator Select the token you want to lock, input lock amount, and select unlock time to see how many voting power you will have. : Create new veTRAVA lock 1. Click Create Lock , a modal will popup. 2. Select the token you want to lock. 3. Input lock amount. 4. Select unlock time (1 week -> 4 years). 5. Click Create Lock . 6. Your wallet notification will appear, you check again the total amount and gas fee. If they are right, click Confirm. : Merge veTRAVA 1. Select 2 veTRAVA tokens to merge together. veTRAVA with Released status can’t be merged. 2. Claim all claimable rewards of 2 veTRAVA tokens. 3. Click Merge. 4. Recheck your veTRAVA info and click Merge to preview merge result. 5. Click Confirm. 6. Your wallet notification will appear, you check again the total amount and gas fee. If they are right, click Confirm. : Claim rewards 1. Click Claim. 2. Your wallet notification will appear, you check again the total amount and gas fee. If they are right, click Confirm. : Withdraw veTRAVA 1. Claim all your claimable rewards. 2. Your wallet notification will appear, you check again the total amount and gas fee. If they are right, click Confirm. Increase your voting power: : Increase locked balance 1. Input the increased amount and see how much voting power you will gain. 2. Click Lock Balance. 3. Your wallet notification will appear, you check again the total amount and gas fee. If they are right, click Confirm. : Increase unlock time 1. Select the unlock time option to increase and see how much voting power you will gain. 2. Click Lock Time. 3. Your wallet notification will appear, you check again the total amount and gas fee. If they are right, click Confirm. How to vote? : : Proposal Status After being created on-chain, a proposal can have 8 types of statuses: * Pending: signals the waiting period before voting, the community can prepare their voting power during this period. * Active: signals the voting period, anyone can vote For or Against once for each proposal. * Cancel: signals a proposal has been canceled by the SAB or the proposer themselves for some reason. * Defeated: signals a defeated proposal. * Succeeded: signals a succeeded proposal, which can only occur when the quorum is reached and the For votes surpass the Against votes. * Queued: signals the delay process for a proposal to be executed after a successful voting period. * Executed: signals all proposal’s actions have been performed correctly. * Expired: signals a proposal could not be executed for some reason after the delay process. : Cast your vote 1. Click the proposal’s title or double-click the proposal component in the proposals list. 2. Read thoroughly the proposal’s details and decide to vote For or Against . 3. Click For/Against button depending on your decision. 4. Click Confirm. 5. Your wallet notification will appear, you check again the total amount and gas fee. If they are right, click Confirm . PreviousTrava Forum User GuideNextTrava Fortune Mining User Guide Last updated 2 years ago Was this helpful?', 'PreviousBRicher User GuideNextveTRAVA Marketplace User Guide Last updated 1 year ago Was this helpful?', 'BSC MainnetConnect wallet: Dashboard Total token voted-locked Total voting power % Voted-locked % Total locked Avg. lock-in period % APR % warm-up APR Governance Voting Power 1W 1M 1Y ALL Created with Highcharts 10.1.0 Voting Power Histogram Created with Highcharts 10.1.0Voting PowerNumber of wallets Lock-in Period Histogram Created with Highcharts 10.1.0Avg. lock-in periodNumber of veTravaNFTs veTrava Holders No.| Wallet Address| Voting Power| Avg. lock-in period ---|---|---|--- Markets Staking Governance Station Trava GPT Markets overview Pools Create Pool Staking overview Governance overview Dashboard Locker Vote Forum Docs Reputation Ranking Station overview Portfolio Freight Junction Partnership Campaign Analytics Recommendation Trava GPT overview Ecosystem NFTBridge Trava GPT Sign In: Your wallet is not connected yet, please connect your wallet!', 'BSC MainnetConnect wallet: Dashboard Total token voted-locked Total voting power % Voted-locked % Total locked Avg. lock-in period % APR % warm-up APR Governance Voting Power 1W 1M 1Y ALL Created with Highcharts 10.1.0 Voting Power Histogram Created with Highcharts 10.1.0Voting PowerNumber of wallets Lock-in Period Histogram Created with Highcharts 10.1.0Avg. lock-in periodNumber of veTravaNFTs veTrava Holders No.| Wallet Address| Voting Power| Avg. lock-in period ---|---|---|--- Markets Staking Governance Station Trava GPT Markets overview Pools Create Pool Staking overview Governance overview Dashboard Locker Vote Forum Docs Reputation Ranking Station overview Portfolio Freight Junction Partnership Campaign Analytics Recommendation Trava GPT overview Ecosystem NFTBridge Trava GPT Sign In: Your wallet is not connected yet, please connect your wallet!', 'As mentioned, with each quiz package, we will set a particular reward amount to distribute equally to the winners of each package. For example, if the total rewards of the Trava Pool Creation Package are 1000$ and there are 10 winners, each can get up to 100$. However, this amount will not be fully sent to the winner but also be contributed to the other funds used for philanthropy activities, or rewarding the Governance, Top user, etc. In particular, the reward (as in the example is 100$) will be spent as below: * 40%: For winners directly through their wallets (claimable within one week after the quiz end)**. ** * 40%: For winners through the vesting pool. * 5%: For the top 5 users of all quiz packages. * 5%: For the Governance (veTRAVA holders). * 10%: For referral rewards - If there is no referral, this amount will be used for philanthropy. PreviousHow to join Trava Pottery?NextVesting pool mechanism Last updated 1 year ago', 'Login × **Login Unsuccessful** × Looks like your connection to Trava Forum was lost, please wait while we try to reconnect.', 'Register **Registration Error** × Looks like your connection to Trava Forum was lost, please wait while we try to reconnect.']","['https://docs.trava.finance/user-guide/trava-dao-user-guide', 'https://docs.trava.finance/user-guide/trava-pottery-user-guide', 'https://app.trava.finance/governance', 'https://app.trava.finance/governance/dashboard', 'https://docs.trava.finance/pottery-mechanism/rewards-mechanism', 'https://gov.trava.finance/login', 'https://gov.trava.finance/register']",['https://docs.trava.finance/user-guide/trava-dao-user-guide']
How to withdraw veTRAVA tokens?,0.8095,False,"['1. Claim all your claimable rewards. 2. Your wallet notification will appear, you check again the total amount and gas fee. If they are right, click Confirm. ']","['Lock your tokens for veTRAVA: : Lock Calculator Select the token you want to lock, input lock amount, and select unlock time to see how many voting power you will have. : Create new veTRAVA lock 1. Click Create Lock , a modal will popup. 2. Select the token you want to lock. 3. Input lock amount. 4. Select unlock time (1 week -> 4 years). 5. Click Create Lock . 6. Your wallet notification will appear, you check again the total amount and gas fee. If they are right, click Confirm. : Merge veTRAVA 1. Select 2 veTRAVA tokens to merge together. veTRAVA with Released status can’t be merged. 2. Claim all claimable rewards of 2 veTRAVA tokens. 3. Click Merge. 4. Recheck your veTRAVA info and click Merge to preview merge result. 5. Click Confirm. 6. Your wallet notification will appear, you check again the total amount and gas fee. If they are right, click Confirm. : Claim rewards 1. Click Claim. 2. Your wallet notification will appear, you check again the total amount and gas fee. If they are right, click Confirm. : Withdraw veTRAVA 1. Claim all your claimable rewards. 2. Your wallet notification will appear, you check again the total amount and gas fee. If they are right, click Confirm. Increase your voting power: : Increase locked balance 1. Input the increased amount and see how much voting power you will gain. 2. Click Lock Balance. 3. Your wallet notification will appear, you check again the total amount and gas fee. If they are right, click Confirm. : Increase unlock time 1. Select the unlock time option to increase and see how much voting power you will gain. 2. Click Lock Time. 3. Your wallet notification will appear, you check again the total amount and gas fee. If they are right, click Confirm. How to vote? : : Proposal Status After being created on-chain, a proposal can have 8 types of statuses: * Pending: signals the waiting period before voting, the community can prepare their voting power during this period. * Active: signals the voting period, anyone can vote For or Against once for each proposal. * Cancel: signals a proposal has been canceled by the SAB or the proposer themselves for some reason. * Defeated: signals a defeated proposal. * Succeeded: signals a succeeded proposal, which can only occur when the quorum is reached and the For votes surpass the Against votes. * Queued: signals the delay process for a proposal to be executed after a successful voting period. * Executed: signals all proposal’s actions have been performed correctly. * Expired: signals a proposal could not be executed for some reason after the delay process. : Cast your vote 1. Click the proposal’s title or double-click the proposal component in the proposals list. 2. Read thoroughly the proposal’s details and decide to vote For or Against . 3. Click For/Against button depending on your decision. 4. Click Confirm. 5. Your wallet notification will appear, you check again the total amount and gas fee. If they are right, click Confirm . PreviousTrava Forum User GuideNextTrava Fortune Mining User Guide Last updated 2 years ago Was this helpful?', 'PreviousBRicher User GuideNextveTRAVA Marketplace User Guide Last updated 1 year ago Was this helpful?', 'BSC MainnetConnect wallet: Dashboard Total token voted-locked Total voting power % Voted-locked % Total locked Avg. lock-in period % APR % warm-up APR Governance Voting Power 1W 1M 1Y ALL Created with Highcharts 10.1.0 Voting Power Histogram Created with Highcharts 10.1.0Voting PowerNumber of wallets Lock-in Period Histogram Created with Highcharts 10.1.0Avg. lock-in periodNumber of veTravaNFTs veTrava Holders No.| Wallet Address| Voting Power| Avg. lock-in period ---|---|---|--- Markets Staking Governance Station Trava GPT Markets overview Pools Create Pool Staking overview Governance overview Dashboard Locker Vote Forum Docs Reputation Ranking Station overview Portfolio Freight Junction Partnership Campaign Analytics Recommendation Trava GPT overview Ecosystem NFTBridge Trava GPT Sign In: Your wallet is not connected yet, please connect your wallet!', 'BSC MainnetConnect wallet: Dashboard Total token voted-locked Total voting power % Voted-locked % Total locked Avg. lock-in period % APR % warm-up APR Governance Voting Power 1W 1M 1Y ALL Created with Highcharts 10.1.0 Voting Power Histogram Created with Highcharts 10.1.0Voting PowerNumber of wallets Lock-in Period Histogram Created with Highcharts 10.1.0Avg. lock-in periodNumber of veTravaNFTs veTrava Holders No.| Wallet Address| Voting Power| Avg. lock-in period ---|---|---|--- Markets Staking Governance Station Trava GPT Markets overview Pools Create Pool Staking overview Governance overview Dashboard Locker Vote Forum Docs Reputation Ranking Station overview Portfolio Freight Junction Partnership Campaign Analytics Recommendation Trava GPT overview Ecosystem NFTBridge Trava GPT Sign In: Your wallet is not connected yet, please connect your wallet!', 'As mentioned, with each quiz package, we will set a particular reward amount to distribute equally to the winners of each package. For example, if the total rewards of the Trava Pool Creation Package are 1000$ and there are 10 winners, each can get up to 100$. However, this amount will not be fully sent to the winner but also be contributed to the other funds used for philanthropy activities, or rewarding the Governance, Top user, etc. In particular, the reward (as in the example is 100$) will be spent as below: * 40%: For winners directly through their wallets (claimable within one week after the quiz end)**. ** * 40%: For winners through the vesting pool. * 5%: For the top 5 users of all quiz packages. * 5%: For the Governance (veTRAVA holders). * 10%: For referral rewards - If there is no referral, this amount will be used for philanthropy. PreviousHow to join Trava Pottery?NextVesting pool mechanism Last updated 1 year ago', 'Login × **Login Unsuccessful** × Looks like your connection to Trava Forum was lost, please wait while we try to reconnect.', 'Register **Registration Error** × Looks like your connection to Trava Forum was lost, please wait while we try to reconnect.']","['https://docs.trava.finance/user-guide/trava-dao-user-guide', 'https://docs.trava.finance/user-guide/trava-pottery-user-guide', 'https://app.trava.finance/governance', 'https://app.trava.finance/governance/dashboard', 'https://docs.trava.finance/pottery-mechanism/rewards-mechanism', 'https://gov.trava.finance/login', 'https://gov.trava.finance/register']",['https://docs.trava.finance/user-guide/trava-dao-user-guide']
